pmid,pmc,ref_id,pmid_cited,doi_cited,article_title,name,year,journal,journal_type,Source_Paper_PMC
41549618,,bjop70056-bib-0001,39635926,,Computers and chess masters: The role of AI in transforming elite human performance.,,2024,British Journal of Psychology,journal,PMC13051041
41549618,,bjop70056-bib-0002,39966944,,Why moral judgements change across variations of trolley‐like problems.,,2025,British Journal of Psychology,journal,PMC13051041
41549618,,bjop70056-bib-0003,39871780,,Keep bright in the dark: Multimodal emotional effects on donation‐based crowdfunding performance and their empathic mechanisms.,,2025,British Journal of Psychology,journal,PMC13051041
41549618,,bjop70056-bib-0004,,,Information based explanation methods for deep learning agents—With applications on large open‐source chess models.,,2024,Scientific Reports,journal,PMC13051041
41549618,,bjop70056-bib-0005,39739553,,Artificial intelligence chatbots mimic human collective behaviour.,,2024,British Journal of Psychology,journal,PMC13051041
41549618,,bjop70056-bib-0006,,,,,2016,Proceedings of the IEEE conference on computer vision and pattern recognition,book,PMC13051041
41549618,,bjop70056-bib-0007,,10.1111/tops.12737,Understanding human cognition through computational modelling.,,2024,Topics in Cognitive Science,journal,PMC13051041
41549618,,bjop70056-bib-0008,,,Towards the next generation explainable AI that promotes AI‐human mutual understanding.,,2023,,miscellaneous,PMC13051041
41549618,,bjop70056-bib-0009,38886926,,Decoding the language of first impressions: Comparing models of first impressions of faces derived from free‐text descriptions and trait ratings.,,2024,British Journal of Psychology,journal,PMC13051041
41549618,,bjop70056-bib-0010,39095975,,Scoping review on natural language processing applications in counselling and psychotherapy.,,2024,British Journal of Psychology,journal,PMC13051041
41549618,,bjop70056-bib-0011,,10.1016/j.neunet.2024.106392,Human attention‐guided explainable artificial intelligence for computer vision models.,,2024,Neural Networks,journal,PMC13051041
41549618,,bjop70056-bib-0012,39545786,,Automated face recognition assists with low‐prevalence face identity mismatches but can bias users.,,2024,British Journal of Psychology,journal,PMC13051041
41549618,,bjop70056-bib-0013,39230876,,People have different expectations for their own versus others' use of AI‐mediated communication tools.,,2024,British Journal of Psychology,journal,PMC13051041
41549618,,bjop70056-bib-0027,,,,,2018,Proceedings of the 2018 British Machine Vision Conference,book,PMC13051041
41549618,,bjop70056-bib-0014,40364689,,The state of modelling face processing in humans with deep learning.,,2025,British Journal of Psychology,journal,PMC13051041
41549618,,bjop70056-bib-0015,,,,L. K. Samuelson,2024,Proceedings of the 46th annual conference of the cognitive science society,book,PMC13051041
41549618,,bjop70056-bib-0016,,,,D. Barner,2025,Proceedings of the 47th annual conference of the cognitive science society,book,PMC13051041
41549618,,bjop70056-bib-0017,38858823,,Explanation strategies in humans vs. current explainable AI: Insights from image classification.,,2024,British Journal of Psychology,journal,PMC13051041
41549618,,bjop70056-bib-0018,,10.1109/TNNLS.2016.2599820,Evaluating the visualization of what a deep neural network has learned.,,2017,IEEE Transactions on Neural Networks and Learning Systems,journal,PMC13051041
41549618,,bjop70056-bib-0019,39460393,,The differences in essential facial areas for impressions between humans and deep learning models: An eye‐tracking and explainable AI approach.,,2024,British Journal of Psychology,journal,PMC13051041
41549618,,bjop70056-bib-0020,,,Grad‐CAM: Visual explanations from deep networks via gradient‐based localization.,,2020,International Journal of Computer Vision,journal,PMC13051041
41549618,,bjop70056-bib-0021,33159244,,Artificial cognition: How experimental psychology can help generate explainable artificial intelligence.,,2021,Psychonomic Bulletin & Review,journal,PMC13051041
41549618,,bjop70056-bib-0022,,,ViT‐CX: Causal explanation of vision transformers.,,2022,,miscellaneous,PMC13051041
41549618,,bjop70056-bib-0023,39431949,,Explainability increases trust resilience in intelligent agents.,,2024,British Journal of Psychology,journal,PMC13051041
41549618,,bjop70056-bib-0028,,,,,2023,Proceedings of the 45th Annual Conference of the Cognitive Science Society,book,PMC13051041
41549618,,bjop70056-bib-0024,,,A psychological theory of explainability.,,2022,Proceedings of the International Conference on Machine Learning,journal,PMC13051041
41549618,,bjop70056-bib-0026,33972625,,Mitigating belief projection in explainable artificial intelligence via Bayesian teaching.,,2021,Scientific Reports,journal,PMC13051041
41549618,,bjop70056-bib-0029,38517727,,Gradient‐based instance‐specific visual explanations for object specification and object discrimination.,,2024,IEEE Transactions on Pattern Analysis and Machine Intelligence,journal,PMC13051041
41549618,,bjop70056-bib-0030,,,Grad‐ECLIP: Gradient‐based Visual and Textual Explanations for CLIP. arXiv preprint arXiv:2502.18816.,,2025,,miscellaneous,PMC13051041
39860555,,B1-jcm-14-00550,,,"Deep learning in neuroimaging data analysis: Applications, challenges, and solutions",L.K. Avberšek; G. Repovš,2022,Front. Neuroimaging,journal,PMC11766073
39860555,,B2-jcm-14-00550,37972877,,Machine learning and artificial intelligence in neuroscience: A primer for researchers,F. Badrulhisham; E. Pogatzki-Zahn; D. Segelcke; T. Spisak; J. Vollert,2024,Brain Behav. Immun.,journal,PMC11766073
39860555,,B3-jcm-14-00550,,,Convolutional Neural Networks for Automated Classification of Prostate Multiparametric Magnetic Resonance Imaging Based on Image Quality,S. Cipollari; V. Guarrasi; M. Pecoraro; M. Bicchetti; E. Messina; L. Farina; P. Paci; C. Catalano; V. Panebianco,2022,J. Magn. Reson. Imaging JMRI,journal,PMC11766073
39860555,,B4-jcm-14-00550,,10.1016/j.patcog.2022.109031,Transformed domain convolutional neural network for Alzheimer’s disease diagnosis using structural MRI,S. Qasim Abbas; L. Chi; Y.-P.P. Chen,2023,Pattern Recognit.,journal,PMC11766073
39860555,,B5-jcm-14-00550,,,Synaptic Plasticity Dynamics for Deep Continuous Local Learning (DECOLLE),J. Kaiser; H. Mostafa; E. Neftci,2020,Front. Neurosci.,journal,PMC11766073
39860555,,B6-jcm-14-00550,,,Convergence of Artificial Intelligence and Neuroscience towards the Diagnosis of Neurological Disorders—A Scoping Review,C. Surianarayanan; J.J. Lawrence; P.R. Chelliah; E. Prakash; C. Hewage,2023,Sensors,journal,PMC11766073
39860555,,B7-jcm-14-00550,,,Review: Human intracortical recording and neural decoding for brain computer interfaces,D.M. Brandman; S.S. Cash; L.R. Hochberg,2017,IEEE Trans. Neural Syst. Rehabil. Eng.,journal,PMC11766073
39860555,,B8-jcm-14-00550,,,Editorial: Advances in artificial intelligence (AI) in brain computer interface (BCI) and Industry 4.0 for human machine interaction (HMI),U. Asgher; Y. Ayaz; R. Taiar,2023,Front. Hum. Neurosci.,journal,PMC11766073
39860555,,B9-jcm-14-00550,,,Artificial intelligence in drug discovery and development,D. Paul; G. Sanap; S. Shenoy; D. Kalyane; K. Kalia; R.K. Tekade,2020,Drug Discov. Today,journal,PMC11766073
39860555,,B10-jcm-14-00550,36640927,,Making use of noise in biological systems,Y. Ilan,2023,Prog. Biophys. Mol. Biol.,journal,PMC11766073
39860555,,B11-jcm-14-00550,,,Addressing privacy risk in neuroscience data: From data protection to harm prevention,A.S. Jwa; R.A. Poldrack,2022,J. Law Biosci.,journal,PMC11766073
39860555,,B12-jcm-14-00550,,,Artificial Intelligence’s Transformative Role in Illuminating Brain Function in Long COVID Patients Using PET/FDG,T. Rudroff,2024,Brain Sci.,journal,PMC11766073
39860555,,B13-jcm-14-00550,,,Revolutionizing Neurology: The Role of Artificial Intelligence in Advancing Diagnosis and Treatment,M. Kalani; A. Anjankar,2024,Cureus,journal,PMC11766073
39860555,,B14-jcm-14-00550,34649035,,Natural and Artificial Intelligence: A brief introduction to the interplay between AI and neuroscience research,T. Macpherson; A. Churchland; T. Sejnowski; J. DiCarlo; Y. Kamitani; H. Takahashi; T. Hikida,2021,Neural Netw.,journal,PMC11766073
39860555,,B15-jcm-14-00550,,10.4236/jsea.2023.166012,Transforming Data into Actionable Insights with Cognitive Computing and AI,S.A. Mesmari,2023,J. Softw. Eng. Appl.,journal,PMC11766073
39860555,,B16-jcm-14-00550,28728020,,Neuroscience-Inspired Artificial Intelligence,D. Hassabis; D. Kumaran; C. Summerfield; M. Botvinick,2017,Neuron,journal,PMC11766073
39860555,,B17-jcm-14-00550,,,Discovering hidden brain network responses to naturalistic stimuli via tensor component analysis of multi-subject fMRI data,G. Hu; H. Li; W. Zhao; Y. Hao; Z. Bai; L.D. Nickerson; F. Cong,2022,NeuroImage,journal,PMC11766073
39860555,,B18-jcm-14-00550,,,Unsupervised and supervised learning with neural network for human transcriptome analysis and cancer diagnosis,B. Yuan; D. Yang; B.E.G. Rothberg; H. Chang; T. Xu,2020,Sci. Rep.,journal,PMC11766073
39860555,,B19-jcm-14-00550,,,Evaluation of the Hierarchical Correspondence between the Human Brain and Artificial Neural Networks: A Review,T.Q. Pham; T. Matsui; J. Chikazoe,2023,Biology,journal,PMC11766073
39860555,,B20-jcm-14-00550,30195984,,Deep convolutional neural networks for brain image analysis on magnetic resonance imaging: A review,J. Bernal; K. Kushibar; D.S. Asfaw; S. Valverde; A. Oliver; R. Martí; X. Lladó,2019,Artif. Intell. Med.,journal,PMC11766073
39860555,,B21-jcm-14-00550,,10.1016/j.autcon.2011.05.004,Innovation in artificial neural network learning: Learn-On-Demand methodology,F. Khosrowshahi,2011,Autom. Constr.,journal,PMC11766073
39860555,,B22-jcm-14-00550,,10.1007/s44163-021-00009-x,The golden age of Artificial Intelligence,O. Kaynak,2021,Discov. Artif. Intell.,journal,PMC11766073
39860555,,B23-jcm-14-00550,,,Convolutional neural networks: An overview and application in radiology,R. Yamashita; M. Nishio; R.K.G. Do; K. Togashi,2018,Insights Imaging,journal,PMC11766073
39860555,,B24-jcm-14-00550,,10.1080/0952813X.2024.2323042,Artificial intelligence: Reflecting on the past and looking towards the next paradigm shift,P. Radanliev,2024,J. Exp. Theor. Artif. Intell.,journal,PMC11766073
39860555,,B25-jcm-14-00550,,10.1109/TKDE.2024.3472906,Heterogeneous Multivariate Functional Time Series Modeling: A State Space Approach,P. Liu; J. Lin; C. Zhang,2024,IEEE Trans. Knowl. Data Eng.,journal,PMC11766073
39860555,,B26-jcm-14-00550,,10.1016/j.jbusres.2024.114655,Unstructured data research in business: Toward a structured approach,E. de Haan; M. Padigar; S. El Kihal; R. Kübler; J.E. Wieringa,2024,J. Bus. Res.,journal,PMC11766073
39860555,,B27-jcm-14-00550,,10.30574/wjarr.2024.24.3.3671,Advancing clinical trial outcomes using deep learning and predictive modelling: Bridging precision medicine and patient-centered care,S. Anuyah; M.K. Singh; H. Nyavor,2024,World J. Adv. Res. Rev.,journal,PMC11766073
39860555,,B28-jcm-14-00550,,10.3389/fmars.2024.1520401,Enhancing bathymetric prediction by integrating gravity and gravity gradient data with deep learning,J. Li; N. Chao; H. Li; G. Chen; S. Bian; Z. Wang; A. Ma,2024,Front. Mar. Sci.,journal,PMC11766073
39860555,,B29-jcm-14-00550,,10.25139/inform.v9i2.8434,Implementation of Artificial Neural Network in Predicting CPO Prices Using Backpropagation,M.R. Halmi; R.A. Putri,2024,Inf. J. Ilm. Bid. Teknol. Inf. Dan Komun.,journal,PMC11766073
39860555,,B30-jcm-14-00550,,,Human-like problem-solving abilities in large language models using ChatGPT,G. Orrù; A. Piarulli; C. Conversano; A. Gemignani,2023,Front. Artif. Intell.,journal,PMC11766073
39860555,,B31-jcm-14-00550,,10.3390/fi16090318,Graph Attention Networks: A Comprehensive Review of Methods and Applications,A.G. Vrahatis; K. Lazaros; S. Kotsiantis,2024,Future Internet,journal,PMC11766073
39860555,,B32-jcm-14-00550,,10.1109/TASLP.2024.3375631,Question-Directed Reasoning With Relation-Aware Graph Attention Network for Complex Question Answering Over Knowledge Graph,G. Zhang; J. Liu; G. Zhou; K. Zhao; Z. Xie; B. Huang,2024,IEEEACM Trans. Audio Speech Lang. Process.,journal,PMC11766073
39860555,,B33-jcm-14-00550,,,Prediction of Oncomelania hupensis distribution in association with climate change using machine learning models,N. Xu; Y. Zhang; C. Du; J. Song; J. Huang; Y. Gong; H. Jiang; Y. Tong; J. Yin; J. Wang; ,2023,Parasites Vectors,journal,PMC11766073
39860555,,B34-jcm-14-00550,,,Paving the Way for Predicting the Progression of Cognitive Decline: The Potential Role of Machine Learning Algorithms in the Clinical Management of Neurodegenerative Disorders,C. Formica; L. Bonanno; F.M. Giambò; G. Maresca; D. Latella; A. Marra; F. Cucinotta; C. Bonanno; M. Lombardo; O. Tomarchio; ,2023,J. Pers. Med.,journal,PMC11766073
39860555,,B35-jcm-14-00550,,,Predicting future cognitive decline from non-brain and multimodal brain imaging data in healthy and pathological aging,B. Hebling Vieira; F. Liem; K. Dadi; D.A. Engemann; A. Gramfort; P. Bellec; R.C. Craddock; J.S. Damoiseaux; C.J. Steele; T. Yarkoni; ,2022,Neurobiol. Aging,journal,PMC11766073
39860555,,B36-jcm-14-00550,,10.1016/j.prime.2024.100451,Decoding brain signals: A convolutional neural network approach for motor imagery classification,O. Tarahi; S. Hamou; M. Moufassih; S. Agounad; H.I. Azami,2024,E-Prime Adv. Electr. Eng. Electron. Energy,journal,PMC11766073
39860555,,B37-jcm-14-00550,37207412,,Exploring neural heterogeneity in inattention and hyperactivity,N. Zdorovtsova; J. Jones; D. Akarca; E. Benhamou; ; D.E. Astle,2023,Cortex,journal,PMC11766073
39860555,,B38-jcm-14-00550,,,Unsupervised machine learning using K-means identifies radiomic subgroups of pediatric low-grade gliomas that correlate with key molecular markers,D. Haldar; A.F. Kazerooni; S. Arif; A. Familiar; R. Madhogarhia; N. Khalili; S. Bagheri; H. Anderson; I.S. Shaikh; A. Mahtabfar; ,2023,Neoplasia,journal,PMC11766073
39860555,,B39-jcm-14-00550,,,Single-cell RNA-seq reveals the role of YAP1 in prefrontal cortex microglia in depression,F. Ma; H. Bian; W. Jiao; N. Zhang,2024,BMC Neurol.,journal,PMC11766073
39860555,,B40-jcm-14-00550,,,A generalization of t-SNE and UMAP to single-cell multimodal omics,V.H. Do; S. Canzar,2021,Genome Biol.,journal,PMC11766073
39860555,,B41-jcm-14-00550,,,Beyond the brain-computer interface: Decoding brain activity as a tool to understand neuronal mechanisms subtending cognition and behavior,C. Loriette; J.L. Amengual; S.B. Hamed,2022,Front. Neurosci.,journal,PMC11766073
39860555,,B42-jcm-14-00550,,10.3390/app14188380,Cognitive State Classification Using Convolutional Neural Networks on Gamma-Band EEG Signals,N. Avital; E. Nahum; G.C. Levi; D. Malka,2024,Appl. Sci.,journal,PMC11766073
39860555,,B43-jcm-14-00550,,10.1016/j.neucom.2023.126281,AID-RL: Active information-directed reinforcement learning for autonomous source seeking and estimation,Z. Li; W.-H. Chen; J. Yang; Y. Yan,2023,Neurocomputing,journal,PMC11766073
39860555,,B44-jcm-14-00550,,10.1016/j.commtr.2024.100142,Traffic expertise meets residual RL: Knowledge-informed model-based residual reinforcement learning for CAV trajectory control,Z. Sheng; Z. Huang; S. Chen,2024,Commun. Transp. Res.,journal,PMC11766073
39860555,,B45-jcm-14-00550,37116767,,Accurate and Efficient Simulation of Very High-Dimensional Neural Mass Models with Distributed-Delay Connectome Tensors,A.G. Mitjans; D.P. Linares; C.L. Naranjo; A.A. Gonzalez; M. Li; Y. Wang; R.G. Reyes; M.L. Bringas-Vega; L. Minati; A.C. Evans; ,2023,NeuroImage,journal,PMC11766073
39860555,,B46-jcm-14-00550,,10.1016/j.inffus.2023.101945,"Computational approaches to Explainable Artificial Intelligence: Advances in theory, applications and trends",J.M. Górriz; I. Álvarez-Illán; A. Álvarez-Marquina; J.E. Arco; M. Atzmueller; F. Ballarini; E. Barakova; G. Bologna; P. Bonomini; G. Castellanos-Dominguez; ,2023,Inf. Fusion,journal,PMC11766073
39860555,,B47-jcm-14-00550,,,Prediction of Post Traumatic Epilepsy Using MR-Based Imaging Markers,H. Akrami; W. Cui; P.E. Kim; C.N. Heck; A. Irimia; K. Jerbi; D. Nair; R.M. Leahy; A.A. Joshi,2024,Hum. Brain Mapp.,journal,PMC11766073
39860555,,B48-jcm-14-00550,,,Learning under social versus nonsocial uncertainty: A meta-analytic approach,M. Martinez-Saito; E. Gorina,2022,Hum. Brain Mapp.,journal,PMC11766073
39860555,,B49-jcm-14-00550,,10.1016/j.techfore.2023.122768,Exploring the drivers of XAI-enhanced clinical decision support systems adoption: Insights from a stimulus-organism-response perspective,M. Dalvi-Esfahani; M. Mosharaf-Dehkordi; L.W. Leong; T. Ramayah; A.M. Jamal Kanaan-Jebna,2023,Technol. Forecast. Soc. Chang.,journal,PMC11766073
39860555,,B50-jcm-14-00550,,10.1016/j.inffus.2024.102412,Designing interpretable ML system to enhance trust in healthcare: A systematic review to proposed responsible clinician-AI-collaboration framework,E. Nasarian; R. Alizadehsani; U.R. Acharya; K.-L. Tsui,2024,Inf. Fusion,journal,PMC11766073
39860555,,B51-jcm-14-00550,,10.1016/j.anucene.2024.110582,Multi-objective reinforcement learning-based approach for pressurized water reactor optimization,P. Seurin; K. Shirvan,2024,Ann. Nucl. Energy,journal,PMC11766073
39860555,,B52-jcm-14-00550,,10.3390/systems12030106,Reinforcement Learning-Based Multi-Objective Optimization for Generation Scheduling in Power Systems,A.S. Ebrie; Y.J. Kim,2024,Systems,journal,PMC11766073
39860555,,B53-jcm-14-00550,,,Convolutional neural networks for brain tumour segmentation,A. Bhandari; J. Koppen; M. Agzarian,2020,Insights Imaging,journal,PMC11766073
39860555,,B54-jcm-14-00550,,10.1016/j.aej.2024.04.023,IFC-GNN: Combining interactions of functional connectivity with multimodal graph neural networks for ASD brain disorder analysis,X. Wang; X. Zhang; Y. Chen; X. Yang,2024,Alex. Eng. J.,journal,PMC11766073
39860555,,B55-jcm-14-00550,,10.1016/j.array.2020.100038,Evaluation of recurrent neural networks as epileptic seizure predictor,L. Bongiorni; A. Balbinot,2020,Array,journal,PMC11766073
39860555,,B56-jcm-14-00550,,,Epileptic seizure prediction via multidimensional transformer and recurrent neural network fusion,R. Zhu; W. Pan; J. Liu; J. Shang,2024,J. Transl. Med.,journal,PMC11766073
39860555,,B57-jcm-14-00550,,10.1016/j.petrol.2021.109760,Impact of data pre-processing techniques on recurrent neural network performance in context of real-time drilling logs in an automated prediction framework,A.T. Tunkiel; D. Sui; T. Wiktorski,2022,J. Pet. Sci. Eng.,journal,PMC11766073
39860555,,B58-jcm-14-00550,,,Exploring Convolutional Neural Network Architectures for EEG Feature Extraction,I. Rakhmatulin; M.-S. Dao; A. Nassibi; D. Mandic,2024,Sensors,journal,PMC11766073
39860555,,B59-jcm-14-00550,39341472,,Towards the definition of a standard in TMS-EEG data preprocessing,A. Brancaccio; D. Tabarelli; A. Zazio; G. Bertazzoli; J. Metsomaa; U. Ziemann; M. Bortoletto; P. Belardinelli,2024,NeuroImage,journal,PMC11766073
39860555,,B60-jcm-14-00550,,10.3390/app14093883,Bridging Modalities: A Multimodal Machine Learning Approach for Parkinson’s Disease Diagnosis Using EEG and MRI Data,M. Alrawis; S. Al-Ahmadi; F. Mohammad,2024,Appl. Sci.,journal,PMC11766073
39860555,,B61-jcm-14-00550,,10.1016/j.inffus.2023.102161,"Transformer-based multimodal feature enhancement networks for multimodal depression detection integrating video, audio and remote photoplethysmograph signals",H. Fan; X. Zhang; Y. Xu; J. Fang; S. Zhang; X. Zhao; J. Yu,2024,Inf. Fusion,journal,PMC11766073
39860555,,B62-jcm-14-00550,,10.3390/ai5020035,Generative Adversarial Networks for Synthetic Data Generation in Finance: Evaluating Statistical Similarities and Quality Assessment,F. Ramzan; C. Sartori; S. Consoli; D. Reforgiato Recupero,2024,AI,journal,PMC11766073
39860555,,B63-jcm-14-00550,,,Applications of generative adversarial networks in neuroimaging and clinical neuroscience,R. Wang; V. Bashyam; Z. Yang; F. Yu; V. Tassopoulou; S.S. Chintapalli; I. Skampardoni; L.P. Sreepada; D. Sahoo; K. Nikita; ,2023,NeuroImage,journal,PMC11766073
39860555,,B64-jcm-14-00550,,10.3390/make6010024,Alzheimer’s Disease Detection Using Deep Learning on Neuroimaging: A Systematic Review,M.G. Alsubaie; S. Luo; K. Shaukat,2024,Mach. Learn. Knowl. Extr.,journal,PMC11766073
39860555,,B65-jcm-14-00550,,10.1007/s10489-022-04148-1,Sim-to-real transfer and reality gap modeling in model predictive control for autonomous driving,I.G. Daza; R. Izquierdo; L.M. Martínez; O. Benderius; D.F. Llorca,2023,Appl. Intell.,journal,PMC11766073
39860555,,B66-jcm-14-00550,,10.1016/j.robot.2023.104432,DROPO: Sim-to-real transfer with offline domain randomization,G. Tiboni; K. Arndt; V. Kyrki,2023,Robot. Auton. Syst.,journal,PMC11766073
39860555,,B67-jcm-14-00550,37683529,,Application of uncertainty quantification to artificial intelligence in healthcare: A review of last decade (2013–2023),S. Seoni; V. Jahmunah; M. Salvi; P.D. Barua; F. Molinari; U.R. Acharya,2023,Comput. Biol. Med.,journal,PMC11766073
39860555,,B68-jcm-14-00550,,10.1016/j.ibmed.2023.100123,Early detection of neurological abnormalities using a combined phase space reconstruction and deep learning approach,A. Al Fahoum; A. Zyout,2023,Intell.-Based Med.,journal,PMC11766073
39860555,,B69-jcm-14-00550,,,Synthetic data generation methods in healthcare: A review on open-source tools and methods,V.C. Pezoulas; D.I. Zaridis; E. Mylona; C. Androutsos; K. Apostolidis; N.S. Tachos; D.I. Fotiadis,2024,Comput. Struct. Biotechnol. J.,journal,PMC11766073
39860555,,B70-jcm-14-00550,,10.1002/brx2.29,Understanding the brain with attention: A survey of transformers in brain sciences,C. Chen; H. Wang; Y. Chen; Z. Yin; X. Yang; H. Ning; Q. Zhang; W. Li; R. Xiao; J. Zhao,2023,Brain-X,journal,PMC11766073
39860555,,B71-jcm-14-00550,,10.3390/su15021628,Cognitive Neuroscience and Education: Not a Gap to Be Bridged but a Common Field to Be Cultivated,D. Basso; M. Cottini,2023,Sustainability,journal,PMC11766073
39860555,,B72-jcm-14-00550,,,Molecular Neuroscience in the 21st Century: A Personal Perspective,T.C. Südhof,2017,Neuron,journal,PMC11766073
39860555,,B73-jcm-14-00550,,,The interplay between neurons and glia in synapse development and plasticity,J.A. Stogsdill; C. Eroglu,2016,Curr. Opin. Neurobiol.,journal,PMC11766073
39860555,,B74-jcm-14-00550,,,Structural plasticity: Mechanisms and contribution to developmental psychiatric disorders,Y. Bernardinelli; I. Nikonenko; D. Muller,2014,Front. Neuroanat.,journal,PMC11766073
39860555,,B75-jcm-14-00550,,,Input specificity of NMDA-dependent GABAergic plasticity in the hippocampus,G. Wiera; J. Jabłońska; A.M. Lech; J.W. Mozrzymas,2024,Sci. Rep.,journal,PMC11766073
39860555,,B76-jcm-14-00550,,,Increased vesicle fusion competence underlies long-term potentiation at hippocampal mossy fiber synapses,R. Fukaya; H. Hirai; H. Sakamoto; Y. Hashimotodani; K. Hirose; T. Sakaba,2023,Sci. Adv.,journal,PMC11766073
39860555,,B77-jcm-14-00550,,,A simple MATLAB toolbox for analyzing calcium imaging data in vitro and in vivo,N.S. Desai; C. Zhong; R. Kim; D.A. Talmage; L.W. Role,2024,J. Neurosci. Methods,journal,PMC11766073
39860555,,B78-jcm-14-00550,36638799,,Hippocampal engram networks for fear memory recruit new synapses and modify pre-existing synapses in vivo,C. Lee; B.H. Lee; H. Jung; C. Lee; Y. Sung; H. Kim; J. Kim; J.Y. Shim; J. Kim; D.I. Choi; ,2023,Curr. Biol.,journal,PMC11766073
39860555,,B79-jcm-14-00550,,,Analyzing the transient response dynamics of long-term depression in the mouse auditory cortex in vitro through multielectrode-array-based spatiotemporal recordings,R. Furukawa; K. Kume; T. Tateno,2024,Front. Neurosci.,journal,PMC11766073
39860555,,B80-jcm-14-00550,,,Step-by-step approach: Stereotaxic surgery for in vivo extracellular field potential recording at the rat Schaffer collateral-CA1 synapse using the eLab system,M. Azimzadeh; M.A.N. Mohd Azmi; P. Reisi; P.-S. Cheah; K.-H. Ling,2024,MethodsX,journal,PMC11766073
39860555,,B81-jcm-14-00550,37379793,,High-resolution CMOS-based biosensor for assessing hippocampal circuit dynamics in experience-dependent plasticity,B.A. Emery; X. Hu; S. Khanzada; G. Kempermann; H. Amin,2023,Biosens. Bioelectron.,journal,PMC11766073
39860555,,B82-jcm-14-00550,,,Genetic mechanisms for impaired synaptic plasticity in schizophrenia revealed by computational modeling,T. Mäki-Marttunen; K.T. Blackwell; I. Akkouh; A. Shadrin; M. Valstad; T. Elvsåshagen; M.-L. Linne; S. Djurovic; G.T. Einevoll; O.A. Andreassen,2024,Proc. Natl. Acad. Sci. USA,journal,PMC11766073
39860555,,B83-jcm-14-00550,,,Mechanisms of Sustained Increases in γ Power Post-Ketamine in a Computational Model of the Hippocampal CA3: Implications for Ketamine’s Antidepressant Mechanism of Action,M. Petzi; S. Singh; T. Trappenberg; A. Nunes,2023,Brain Sci.,journal,PMC11766073
39860555,,B84-jcm-14-00550,36368635,,Long term potentiation-like neural plasticity and performance-based memory function,T.W. Rygvold; C. Hatlestad-Hall; T. Elvsåshagen; T. Moberget; S. Andersson,2022,Neurobiol. Learn. Mem.,journal,PMC11766073
39860555,,B85-jcm-14-00550,,,The role of the salience network in cognitive and affective deficits,J. Schimmelpfennig; J. Topczewski; W. Zajkowski; K. Jankowiak-Siuda,2023,Front. Hum. Neurosci.,journal,PMC11766073
39860555,,B86-jcm-14-00550,,,Rhythms of life: Circadian disruption and brain disorders across the lifespan,R.W. Logan; C.A. McClung,2019,Nat. Rev. Neurosci.,journal,PMC11766073
39860555,,B87-jcm-14-00550,,10.1162/imag_a_00366,Challenges in the measurement and interpretation of dynamic functional connectivity,T.O. Laumann; A.Z. Snyder; C. Gratton,2024,Imaging Neurosci.,journal,PMC11766073
39860555,,B88-jcm-14-00550,,,Editorial: Novel fMRI techniques and analysis methods for enhanced detection of functional disorders,S.D. Yun; S.S. Oh; M.C. Chang,2024,Front. Neurosci.,journal,PMC11766073
