pmid,pmc,ref_id,pmid_cited,doi_cited,article_title,name,year,journal,journal_type,Source_Paper_PMC
39664769,,B121,,,Influences on the test–retest reliability of functional connectivity MRI and its relationship with behavioral utility.,S. Noble; M. N. Spann; F. Tokoglu; X. Shen; R. T. Constable; D. Scheinost; ,2017,Cereb. Cortex,journal,PMC11631947
39664769,,B122,,,"“Explanation of machine learning models using improved shapley additive explanation,” in",Y. Nohara; K. Matsumoto; H. Soejima; N. Nakashima,2019,"Proceedings of the 10th ACM International Conference on Bioinformatics, Computational Biology and Health Informatics",journal,PMC11631947
39664769,,B123,,,Hemispheric differences in white matter microstructure between two profiles of children with high intelligence quotient vs. controls: a tract-based spatial statistics study.,F. Nusbaum; S. Hannoun; G. Kocevar; C. Stamile; P. Fourneret; O. Revol; ,2017,Front. Neurosci,journal,PMC11631947
39664769,,B124,,,Large-scale brain network associated with creative insight: combined voxel-based morphometry and resting-state functional connectivity analyses.,T. Ogawa; T. Aihara; T. Shimokawa; O. Yamashita,2018,Sci. Rep,journal,PMC11631947
39664769,,B125,27840231,,Exploring the neural substrates of attentional control and human intelligence: diffusion tensor imaging of prefrontal white matter tractography in healthy cognition.,T. Ohtani; P. G. Nestor; S. Bouix; D. Newell; E. D. Melonakos; R. W. McCarley; ,2017,Neuroscience,journal,PMC11631947
39664769,,B126,,,Academic outcomes in children with congenital heart defects: a population-based cohort study.,M. E. Oster; S. Watkins; K. D. Hill; J. H. Knight; R. E. Meyer,2017,Circ. Cardiovasc. Qual. Outcomes,journal,PMC11631947
39664769,,B127,,,"“ABCD neurocognitive prediction challenge 2019: predicting individual residual fluid intelligence scores from cortical grey matter morphology,” in",N. P. Oxtoby; F. S. Ferreira; A. Mihalik; T. Wu; M. Brudfors; H. Lin; ,2019,"Adolescent Brain Cognitive Development Neurocognitive Prediction: First Challenge, ABCD-NP 2019, Held in Conjunction with MICCAI 2019",book,PMC11631947
39664769,,B128,12052921,,Learning and memory functions of the basal ganglia.,M. G. Packard; B. J. Knowlton,2002,Annu. Rev. Neurosci,journal,PMC11631947
39664769,,B129,,,Analyzing the association between functional connectivity of the brain and intellectual performance.,G. S. Pamplona; G. S. Santos Neto; S. R. Rosset; B. P. Rogers; C. E. Salmon,2015,Front. Hum. Neurosci,journal,PMC11631947
39664769,,B130,,,Explainable machine learning approach to predict and explain the relationship between task-based fMRI and individual differences in cognition.,N. Pat; Y. Wang; A. Bartonicek; J. Candia; A. Stringaris,2023,Cereb. Cortex,journal,PMC11631947
39664769,,B131,27184204,,Dissociable brain biomarkers of fluid intelligence.,E. J. Paul; R. J. Larsen; A. Nikolaidis; N. Ward; C. H. Hillman; N. J. Cohen; ,2016,Neuroimage,journal,PMC11631947
39664769,,B132,22614288,,Brain white matter tract integrity as a neural foundation for general intelligence.,L. Penke; S. M. Maniega; M. E. Bastin; M. C. Valdés Hernández; C. Murray; N. A. Royle; ,2012,Mol. Psychiatry,journal,PMC11631947
39664769,,B133,,,Resting-state functional connectivity and network analysis of cerebellum with respect to IQ and gender.,V. C. Pezoulas; M. Zervakis; S. Michelogiannis; M. A. Klados,2017,Front. Hum. Neurosci,journal,PMC11631947
39664769,,B134,,,Reduced hippocampal volumes and memory deficits in adolescents with single ventricle heart disease.,N. A. Pike; B. Roy; S. Moye; C. Cabrera-Mino; M. A. Woo; N. J. Halnon; ,2021,Brain Behav,journal,PMC11631947
39664769,,B135,27072165,,Highways of the emotional intellect: white matter microstructural correlates of an ability-based measure of emotional intelligence.,D. A. Pisner; R. Smith; A. Alkozei; A. Klimova; W. D. Killgore,2017,Soc. Neurosci,journal,PMC11631947
39664769,,B136,,,Genetic contributions to human brain morphology and intelligence.,H. E. H. Pol; H. G. Schnack; D. Posthuma; R. C. Mandl; W. F. Baaré; C. van Oel; ,2006,J. Neurosci,journal,PMC11631947
39664769,,B137,25349916,,Making big data open: data sharing in neuroimaging.,R. A. Poldrack; K. J. Gorgolewski,2014,Nat. Neurosci,journal,PMC11631947
39664769,,B138,,,"“Prediction of fluid intelligence from T1-weighted magnetic resonance images,” in",S. Pölsterl; B. Gutiérrez-Becker; I. Sarasua; A. G. Roy; C. Wachinger,2019a,"Adolescent Brain Cognitive Development Neurocognitive Prediction: First Challenge, ABCD-NP 2019, Held in Conjunction with MICCAI 2019",book,PMC11631947
39664769,,B139,,,"“An AutoML approach for the prediction of fluid intelligence from MRI-derived features,” in",S. Pölsterl; B. Gutiérrez-Becker; I. Sarasua; A. G. Roy; C. Wachinger,2019b,"Adolescent Brain Cognitive Development Neurocognitive Prediction: First Challenge, ABCD-NP 2019, Held in Conjunction with MICCAI 2019",book,PMC11631947
39664769,,B140,,,"“Ensemble of 3D CNN regressors with data fusion for fluid intelligence prediction,” in",M. Pominova; A. Kuzina; E. Kondrateva; S. Sushchinskaya; E. Burnaev; V. Yarkin; ,2019,"Adolescent Brain Cognitive Development Neurocognitive Prediction: First Challenge, ABCD-NP 2019, Held in Conjunction with MICCAI 2019",book,PMC11631947
39664769,,B141,,,Structural brain connectivity and cognitive ability differences: a multivariate distance matrix regression analysis.,V. Ponsoda; K. Martínez; J. A. Pineda-Pardo; F. J. Abad; J. Olea; F. J. Román; ,2017,Hum. Brain Mapp,journal,PMC11631947
39664769,,B142,,,"Local connectome phenotypes predict social, health, and cognitive factors.",M. A. Powell; J. O. Garcia; F. C. Yeh; J. M. Vettel; T. Verstynen,2018,Netw Neurosci,journal,PMC11631947
39664769,,B143,,,Crosswalk algorithms for cognitive and functional outcomes among 2013–2018 medicare beneficiaries with dementia.,K. T. Pritchard; M. Mahesri; Q. Chen; C.-T. Yang; G. Brill; D. H. Kim; ,2024,J. Am. Med. Dir. Assoc,journal,PMC11631947
39664769,,B144,,,Verbal and non-verbal intelligence changes in the teenage brain.,S. Ramsden; F. M. Richardson; G. Josse; M. S. Thomas; C. Ellis; C. Shakeshaft; ,2011,Nature,journal,PMC11631947
39664769,,B145,,,"“Sex differences in predicting fluid intelligence of adolescent brain from T1-weighted MRIs,” in",S. Ranjbar; K. W. Singleton; L. Curtin; S. C. Massey; A. Hawkins-Daarud; P. R. Jackson; ,2019,Challenge in Adolescent Brain Cognitive Development Neurocognitive Prediction,book,PMC11631947
39664769,,B146,,,"“Surface-based brain morphometry for the prediction of fluid intelligence in the neurocognitive prediction challenge 2019,” in",M. Rebsamen; C. Rummel; I. Mürner-Lavanchy; M. Reyes; R. Wiest; R. McKinley; ,2019,"Adolescent Brain Cognitive Development Neurocognitive Prediction: First Challenge, ABCD-NP 2019, Held in Conjunction with MICCAI 2019",book,PMC11631947
39664769,,B147,,,"“Predict fluid intelligence of adolescent using ensemble learning,” in",H. Ren; X. Wang; S. Wang; Z. Zhang,2019,"Adolescent Brain Cognitive Development Neurocognitive Prediction: First Challenge, ABCD-NP 2019, Held in Conjunction with MICCAI 2019",book,PMC11631947
39664769,,B148,,,Whole brain size and general mental ability: a review.,J. P. Rushton; C. D. Ankney,2009,Int. J. Neurosci,journal,PMC11631947
39664769,,B149,,10.1016/j.intell.2021.101568,Predicting fluid intelligence in adolescence from structural MRI with deep learning methods.,S. Saha; A. Pagnozzi; D. Bradford; J. Fripp,2021,Intelligence,journal,PMC11631947
39664769,,B150,,,Mendelian randomization.,E. Sanderson; M. M. Glymour; M. V. Holmes; H. Kang; J. Morrison; M. R. Munafò; ,2022,Nat. Rev. Methods Prim,journal,PMC11631947
39664769,,B151,,10.1016/j.intell.2017.10.002,Network connectivity correlates of variability in fluid intelligence performance.,E. Santarnecchi; A. Emmendorfer; S. Tadayon; S. Rossi; A. Rossi; A. Pascual-Leone; ,2017,Intelligence,journal,PMC11631947
39664769,,B152,31682886,,Impact of copy number variation on human neurocognitive deficits and congenital heart defects: a systematic review.,K. Savory; S. Manivannan; M. Zaben; O. Uzun; Y. A. Syed,2020,Neurosci. Biobehav. Rev,journal,PMC11631947
39664769,,B153,,,Cognitive functions correlate with white matter architecture in a normal pediatric population: a diffusion tensor MRI study.,V. J. Schmithorst; M. Wilke; B. J. Dardzinski; S. K. Holland,2005,Hum. Brain Mapp,journal,PMC11631947
39664769,,B154,,,Higher intelligence is associated with less task-related brain network reconfiguration.,D. H. Schultz; M. W. Cole,2016,J. Neurosci,journal,PMC11631947
39664769,,B155,,,Decoding subject-driven cognitive states with whole-brain connectivity patterns.,W. R. Shirer; S. Ryali; E. Rykhlevskaia; V. Menon; M. D. Greicius,2012,Cereb. Cortex,journal,PMC11631947
39664769,,B156,,,Infants with congenital heart defects have reduced brain volumes.,M. B. Skotting; S. F. Eskildsen; A. S. Ovesen; V. S. Fonov; S. Ringgaard; V. E. Hjortdal; ,2021,Sci. Rep,journal,PMC11631947
39664769,,B157,29346749,,Statistical challenges in “big data” human neuroimaging.,S. M. Smith; T. E. Nichols,2018,Neuron,journal,PMC11631947
39664769,,B158,18434203,,Brain spontaneous functional connectivity and intelligence.,M. Song; Y. Zhou; J. Li; Y. Liu; L. Tian; C. Yu; ,2008,Neuroimage,journal,PMC11631947
39664769,,B159,,,Longitudinal mapping of cortical thickness and brain growth in normal children.,E. R. Sowell; P. M. Thompson; C. M. Leonard; S. E. Welcome; E. Kan; A. W. Toga; ,2004,J. Neurosci,journal,PMC11631947
39664769,,B160,14717630,,General intelligence objectively determined and measured.,C. Spearmen,1904,Am. J. Psychol,journal,PMC11631947
39664769,,B161,37990734,,"“A review of taxonomies of explainable artificial intelligence (XAI) methods,” in",T. Speith,2022,"Proceedings of the 2022 ACM Conference on Fairness, Accountability, and Transparency",book,PMC11631947
39664769,,B162,17773467,,"Brain-weight, cranial capacity and the form of the head, and their relations to the mental powers of man.",E. A. Spitzka,1903,Science,journal,PMC11631947
39664769,,B163,,,Early adolescent cortical thinning is related to better neuropsychological performance.,L. M. Squeglia; J. Jacobus; S. F. Sorg; T. L. Jernigan; S. F. Tapert,2013,J. Int. Neuropsychol. Soc,journal,PMC11631947
39664769,,B164,,,Prediction of neurocognition in youth from resting state fMRI.,C. Sripada; S. Rutherford; M. Angstadt; W. K. Thompson; M. Luciana; A. Weigard; ,2020,Mol. Psychiatry,journal,PMC11631947
39664769,,B165,,,"“Predicting fluid intelligence in adolescent brain MRI data: an ensemble approach,” in",S. Srivastava; F. Eitel; K. Ritter,2019,"Adolescent Brain Cognitive Development Neurocognitive Prediction: First Challenge, ABCD-NP 2019, Held in Conjunction with MICCAI 2019",book,PMC11631947
39664769,,B166,,,Differences between chronological and brain age are related to education and self-reported physical activity.,J. Steffener; C. Habeck; D. O'Shea; Q. Razlighi; L. Bherer; Y. Stern; ,2016,Neurobiol. Aging,journal,PMC11631947
39664769,,B167,33965470,,Neurocognitive disorders amongst patients with congenital heart disease undergoing procedures in childhood.,L. H. Sterling; A. Liu; E. Ganni; J. Therrien; A. B. Dancea; L. Guo; ,2021,Int. J. Cardiol,journal,PMC11631947
39664769,,B168,,,"Differential contribution of cortical thickness, surface area, and gyrification to fluid and crystallized intelligence.",E. Tadayon; A. Pascual-Leone; E. Santarnecchi,2020,Cereb. Cortex,journal,PMC11631947
39664769,,B169,,,"“Ensemble of SVM, random-forest and the bswims method to predict and describe structural associations with fluid intelligence scores from t1-weighed MRI,” in",J. Tamez-Pena; J. Orozco; P. Sosa; A. Valdes; F. Nezhadmoghadam,2019,"Adolescent Brain Cognitive Development Neurocognitive Prediction: First Challenge, ABCD-NP 2019, Held in Conjunction with MICCAI 2019",book,PMC11631947
39664769,,B170,16839308,,Performance feedback drives caudate activation in a phonological learning task.,E. Tricomi; M. R. Delgado; B. D. McCandliss; J. L. McClelland; J. A. Fiez,2006,J. Cogn. Neurosci,journal,PMC11631947
39664769,,B171,29398281,,Neurocognitive outcomes after heart transplantation in early childhood.,S. Urschel; G. Y. Bond; I. A. Dinu; F. Moradi; J. Conway; G Garcia-Guerra; ,2018,J. Heart Lung Transplant,journal,PMC11631947
39664769,,B172,25284305,,Functional brain networks contributing to the Parieto-Frontal Integration Theory of Intelligence.,A. A. Vakhtin; S. G. Ryman; R. A. Flores; R. E. Jung,2014,Neuroimage,journal,PMC11631947
39664769,,B173,,,"“Predicting intelligence based on cortical WM/GM contrast, cortical thickness and volumetry,” in",J. M. Valverde; V. Imani; J. D. Lewis; J. Tohka,2019,"Adolescent Brain Cognitive Development Neurocognitive Prediction: First Challenge, ABCD-NP 2019, Held in Conjunction with MICCAI 2019",book,PMC11631947
39664769,,B174,,,"“A combined deep learning-gradient boosting machine framework for fluid intelligence prediction,” in",Y. S. Vang; Y. Cao; X. A. Xie,2019,"Adolescent Brain Cognitive Development Neurocognitive Prediction: First Challenge, ABCD-NP 2019, Held in Conjunction with MICCAI 2019",book,PMC11631947
39664769,,B175,,,Hemispheric differences in relational reasoning: novel insights based on an old technique.,M. S. Vendetti; E. L. Johnson; C. J. Lemos; S. A. Bunge,2015,Front. Hum. Neurosci,journal,PMC11631947
39664769,,B176,21108990,,Regional homogeneity of the resting-state brain activity correlates with individual intelligence.,L. Wang; M. Song; T. Jiang; Y. Zhang; C. Yu,2011,Neurosci. Lett,journal,PMC11631947
39664769,,B177,,,MRI-based intelligence quotient (IQ) estimation with sparse learning.,L. Wang; C. Y. Wee; H. I. Suk; X. Tang; D. Shen,2015,PLoS ONE,journal,PMC11631947
39664769,,B178,,,COMBAT: a combined association test for genes using summary statistics.,M. Wang; J. Huang; Y. Liu; L. Ma; J. B. Potash; S. Han; ,2017,Genetics,journal,PMC11631947
39664769,,B179,,,Sex differences in white matter development during adolescence: a DTI study.,Y. Wang; C. Adamson; W. Yuan; M. Altaye; A. Rajagopal; A. W. Byars; ,2012,Brain Res,journal,PMC11631947
39664769,,B180,29934026,,Altered white matter microstructure correlates with IQ and processing speed in children and adolescents post-fontan.,C. G. Watson; C. Stopp; D. Wypij; D. C. Bellinger; J. W. Newburger; M. J. Rivkin; ,2018,J Pediatr,journal,PMC11631947
39664769,,B181,,,Wechsler abbreviated scale of intelligence.,D. Wechsler,1999,Psych. Corp.,journal,PMC11631947
39664769,,B182,18502729,,Error-related negativity is mediated by fractional anisotropy in the posterior cingulate gyrus—a study combining diffusion tensor imaging and electrophysiology in healthy adults.,L. T. Westlye; K. B. Walhovd; A. Bjørnerud; P. Due-Tønnessen; A. M. Fjell,2009,Cereb. Cortex,journal,PMC11631947
39664769,,B183,21225900,,Multiple imputation using chained equations: issues and guidance for practice.,I. R. White; P. Royston; A. M. Wood,2011,Stat. Med,journal,PMC11631947
39664769,,B184,,,Voxel-based morphometry: an automated technique for assessing structural changes in the brain.,J. L. Whitwell,2009,J. Neurosci,journal,PMC11631947
39664769,,B185,,,"“Predicting fluid intelligence from structural MRI Using Random Forest regression,” in",A. Wlaszczyk; A. Kaminska; A. Pietraszek; J. Dabrowski; M. A. Pawlak; H. Nowicka; ,2019,"Adolescent Brain Cognitive Development Neurocognitive Prediction: First Challenge, ABCD-NP 2019, Held in Conjunction with MICCAI 2019",book,PMC11631947
39664769,,B186,9343609,,A voxel-based method for the statistical analysis of gray and white matter density applied to schizophrenia.,I. C. Wright; P. K. McGuire; J. B. Poline; J. M. Travere; R. M. Murray; C. D. Frith; ,1995,Neuroimage,journal,PMC11631947
39664769,,B187,23643979,,Prediction for human intelligence using morphometric characteristics of cortical surface: partial least square analysis.,J.-J. Yang; U. Yoon; H. J. Yun; K. Im; Y. Y. Choi; K. H. Lee; ,2013,Neuroscience,journal,PMC11631947
39664769,,B188,,10.1109/TKDE.2019.2958342,A survey on canonical correlation analysis.,X. Yang; W. Liu; W. Liu; D. Tao,2019,IEEE Trans. Knowl. Data Eng,journal,PMC11631947
39664769,,B189,,,Multivariate approaches improve the reliability and validity of functional connectivity and prediction of individual behaviors.,K. Yoo; M. D. Rosenberg; S. Noble; D. Scheinost; R. T. Constable; M. M. Chun; ,2019,Neuroimage,journal,PMC11631947
39664769,,B190,,,Infant brain development prediction with latent partial multi-view representation learning.,C. Zhang; E. Adeli; Z. Wu; G. Li; W. Lin; D. Shen; ,2018,IEEE Trans. Med. Imaging,journal,PMC11631947
39664769,,B191,33594350,,"“Infant cognitive scores prediction with multi-stream attention-based temporal path signature features,” in",X. Zhang; J. Cheng; H. Ni; C. Li; X. Xu; Z. Wu; ,2020,"Medical Image Computing and Computer Assisted Intervention MICCAI 2020: 23rd International Conference, Proceedings, Part VII 23",book,PMC11631947
39664769,,B192,,,Tensor network factorizations: relationships between brain structural connectomes and traits.,Z. Zhang; G. I. Allen; H. Zhu; D. Dunson,2019,Neuroimage,journal,PMC11631947
39664769,,B193,,,"“Nu support vector machine in prediction of fluid intelligence using MRI data,” in",Y. Zhang-James; S. J. Glatt; S. V. Faraone,2019,"Adolescent Brain Cognitive Development Neurocognitive Prediction: First Challenge, ABCD-NP 2019, Held in Conjunction with MICCAI 2019",book,PMC11631947
39664769,,B194,,,"“Cortical and subcortical contributions to predicting intelligence using 3D ConvNets,” in",Y. Zou; I. Jang; T. G. Reese; J. Yao; W. Zhu; J. V. Rispoli; ,2019,"Adolescent Brain Cognitive Development Neurocognitive Prediction: First Challenge, ABCD-NP 2019, Held in Conjunction with MICCAI 2019",book,PMC11631947
34268435,,r1,30733322,,Machine learning in nuclear medicine: part 1-introduction.,CF Uribe; S Mathotaarachchi; V Gaudet; ,2019,J Nucl Med,journal,PMC8246223
34268435,,r2,,,Machine learning and imaging informatics in oncology.,HH Tseng; L Wei; S Cui; ,2020,Oncology,journal,PMC8246223
34268435,,r3,,,PET/MRI radiomics in patients with brain metastases.,P Lohmann; M Kocher; MI Ruge; ,2020,Front Neurol,journal,PMC8246223
34268435,,r4,,,Use of multimodality imaging and artificial intelligence for diagnosis and prognosis of early stages of Alzheimer's disease.,X Liu; K Chen; T Wu; ,2018,Transl Res,journal,PMC8246223
34268435,,r5,,,Next generation research applications for hybrid PET/MR and PET/CT imaging using deep learning.,G. Zaharchuk,2019,Eur J Nucl Med Mol Imaging,journal,PMC8246223
34268435,,r6,,,Improving PET imaging acquisition and analysis with machine learning: a narrative review with focus on Alzheimer's disease and oncology.,IR Duffy; AJ Boyle; N Vasdev,2019,Mol Imaging,journal,PMC8246223
34268435,,r7,28192624,,MR-based synthetic CT generation using a deep convolutional neural network method.,X. Han,2017,Med Phys,journal,PMC8246223
34268435,,r8,,,Deep learning MR imaging-based attenuation correction for PET/MR imaging.,F Liu; H Jang; R Kijowski; ,2018,Radiology,journal,PMC8246223
34268435,,r9,32492585,,Deep learning-guided estimation of attenuation correction factors from time-of-flight PET emission data.,H Arabi; H Zaidi,2020,Med Image Anal,journal,PMC8246223
34268435,,r10,,,Deep learning-guided joint attenuation and scatter correction in multitracer neuroimaging studies.,H Arabi; K Bortolin; N Ginovart; ,2020,Hum Brain Mapp,journal,PMC8246223
34268435,,r11,29449446,,Improving the accuracy of simultaneously reconstructed activity and attenuation maps using deep learning.,D Hwang; KY Kim; SK Kang; ,2018,J Nucl Med,journal,PMC8246223
34268435,,r12,31227879,,Direct attenuation correction of brain PET images using only emission data via a deep convolutional encoder-decoder (Deep-DAC).,I Shiri; P Ghafarian; P Geramifar; ,2019,Eur Radiol,journal,PMC8246223
34268435,,r13,,,Independent attenuation correction of whole body [18F]FDG-PET using a deep learning approach with Generative Adversarial Networks.,K Armanious; T Hepp; T Küstner; ,2020,EJNMMI Res,journal,PMC8246223
34268435,,r14,32663812,,Obtaining PET/CT images from non-attenuation corrected PET images in a single PET system using Wasserstein generative adversarial networks.,Z Hu; Y Li; S Zou; ,2020,Phys Med Biol,journal,PMC8246223
34268435,,r15,,,Deep learning-based attenuation correction in the absence of structural information for whole-body positron emission tomography imaging.,X Dong; Y Lei; T Wang; ,2020,Phys Med Biol,journal,PMC8246223
34268435,,r16,,,Performance comparison of individual and ensemble CNN models for the classification of brain [18F]FDG-PET Scans.,T Nobashi; C Zacharias; JK Ellis; ,2020,J Digit Imaging,journal,PMC8246223
34268435,,r17,27273293,,ATLAAS: an automatic decision tree-based learning algorithm for advanced image segmentation in positron emission tomography.,B Berthon; C Marshall; M Evans; ,2016,Phys Med Biol,journal,PMC8246223
34268435,,r18,28126329,,Head and neck target delineation using a novel PET automatic segmentation algorithm.,B Berthon; M Evans; C Marshall; ,2017,Radiother Oncol,journal,PMC8246223
34268435,,r19,,,Fully Automated delineation of gross tumor volume for head and neck cancer on PET-CT using deep learning: a dual-center study.,B Huang; Z Chen; PM Wu; ,2018,Contrast Media Mol Imaging,journal,PMC8246223
34268435,,r20,,,Automatic lesion detection and segmentation of [18F]FET PET in gliomas: a full 3D U-Net convolutional neural network study.,P Blanc-Durand; A Van Der Gucht; N Schaefer; ,2018,PLoS One,journal,PMC8246223
34268435,,r21,,,Voxel-based [18F]FET PET segmentation and automatic clustering of tumor voxels: a significant association with IDH1 mutation status and survival in patients with gliomas.,P Blanc-Durand; A Van Der Gucht; A Verger; ,2018,PLoS One,journal,PMC8246223
34268435,,r22,29175980,,"Glioma survival prediction with combined analysis of in vivo [11C]MET PET features, ex vivo features, and patient features by supervised machine learning.",L Papp; N Pötsch; M Grahovac; ,2018,J Nucl Med,journal,PMC8246223
34268435,,r23,,,"Personalized radiotherapy design for glioblastoma: integrating mathematical tumor models, multimodal scans, and bayesian inference.",J Lipkova; P Angelikopoulos; S Wu; ,2019,IEEE Trans Med Imaging,journal,PMC8246223
34268435,,r24,30516675,,"Hybrid [11C]MET PET/MRI combined with ""machine learning"" in glioma diagnosis according to the revised glioma WHO classification 2016.",S Kebir; M Weber; L Lazaridis; ,2019,Clin Nucl Med,journal,PMC8246223
34268435,,r25,12687915,,Positron emission tomography imaging of brain tumors.,TZ Wong; GJ van der Westhuizen; RE Coleman,2002,Neuroimaging Clin N Am,journal,PMC8246223
34268435,,r26,30219733,,A smart and operator independent system to delineate tumours in positron emission tomography scans.,A Comelli; A Stefano; G Russo; ,2018,Comput Biol Med,journal,PMC8246223
34268435,,r27,30871684,,Active contour algorithm with discriminant analysis for delineating tumors in positron emission tomography.,A Comelli; A Stefano; S Bignardi; ,2019,Artif Intell Med,journal,PMC8246223
34268435,,r28,,,Development of a new fully three-dimensional methodology for tumours delineation in functional images.,A Comelli; S Bignardi; A Stefano; ,2020,Comput Biol Med,journal,PMC8246223
34268435,,r29,24782454,,"High-grade glioma: ESMO clinical practice guidelines for diagnosis, treatment and follow-up.",R Stupp; M Brada; MJ van den Bent; ,2014,Ann Oncol,journal,PMC8246223
34268435,,r30,,,Defining the tumour and target volumes for radiotherapy.,NG Burnet; SJ Thomas; KE Burton; ,2004,Cancer Imaging,journal,PMC8246223
34268435,,r31,,,Histogram-based features selection and volume of interest ranking for brain PET image classification.,I Garali; M Adel; S Bourennane; ,2018,IEEE J Transl Eng Health Med,journal,PMC8246223
34268435,,r32,31348088,,The use of random forests to classify amyloid brain PET.,K Zukotynski; V Gaudet; PH Kuo; ,2019,Clin Nucl Med,journal,PMC8246223
34268435,,r33,32366785,,The use of random forests to identify brain regions on amyloid and [18F]FDG-PET associated with MoCA score.,K Zukotynski; V Gaudet; PH Kuo; ,2020,Clin Nucl Med,journal,PMC8246223
34268435,,r34,,,Neuroimaging modality fusion in Alzheimer's classification using convolutional neural networks.,A Punjabi; A Martersteck; Y Wang; ,2019,PLoS One,journal,PMC8246223
34268435,,r35,30776000,,Head-to-head comparison among semi-quantification tools of brain [18F]FDG-PET to aid the diagnosis of prodromal Alzheimer's disease.,A Brugnolo; F De Carli; M Pagani; ,2019,J Alzheimers Dis,journal,PMC8246223
34268435,,r36,,,Deep learning only by normal brain PET identify unheralded brain anomalies.,H Choi; S Ha; H Kang; ,2019,EBioMedicine,journal,PMC8246223
34268435,,r37,28756942,,Identifying incipient dementia individuals using machine learning and amyloid imaging.,S Mathotaarachchi; TA Pascoal; M Shin; ,2017,Neurobiol Aging,journal,PMC8246223
34268435,,r38,,,Predicting sporadic Alzheimer's disease progression via inherited Alzheimer's disease-informed machine-learning.,N Franzmeier; N Koutsouleris; T Benzinger; ,2020,Alzheimers Dement,journal,PMC8246223
34268435,,r39,,,Tracking pathophysiological processes in Alzheimer's disease: an updated hypothetical model of dynamic biomarkers.,CR Jack; DS Knopman; WJ Jagust; ,2013,Lancet Neurol,journal,PMC8246223
34268435,,r40,,10.1007/s10462-009-9124-7,Ensemble-based classifiers.,L. Rokach,2010,Artif Intell Rev,journal,PMC8246223
34268435,,r41,,,Predicting amyloid-β levels in amnestic mild cognitive impairment using machine learning techniques.,A Ezzati; DJ Harvey; C Habeck; ,2020,J Alzheimers Dis,journal,PMC8246223
